{
  "artifacts": [
    {
      "path": "shuttle.mp4",
      "sha256": "c03fc8a6582542c38437ec6bd0494dd1b564feecf19f3821c53ede5e2e366ffd"
    },
    {
      "path": "shuttle_preview.gif",
      "sha256": "a1efe6e51655f3b8a265e81f65e650c51a7610bce606f042f28f9d5c78ded3ab"
    },
    {
      "path": "shuttle_contact_sheet.jpg",
      "sha256": "a1086bbd7f499b475516d3aa3fbf97dfa041f47ed930a52e4c387f1b99e3918e"
    }
  ],
  "camera": "isometric",
  "contract_hash": "88b523993ee4343835a5265a7498498bb79bd95c45ef142d7f642b074af055cb",
  "fps": 8,
  "frame_count": 25,
  "model_hash": "0dbe0690ebfc1d357e097ff66e7b2597182a7bc070f0902595ef0393f4c92934",
  "motion_audit": {
    "collision_audit": {
      "complete": true,
      "coverage": "declared_pairs",
      "method": "brep",
      "pair_evaluations": 87,
      "peak_intersection_mm3": 0.0
    },
    "findings": [],
    "geometry_status": "PASS",
    "limitations": [
      "Sampled nominal CAD checks only; motion between samples, forces, tolerances and real safety remain unverified.",
      "Collision coverage is limited to declared entity pairs."
    ],
    "physical_status": "YELLOW",
    "safety_status": "YELLOW",
    "sample_times": [
      0.0,
      0.003,
      0.125,
      0.25,
      0.375,
      0.5,
      0.625,
      0.75,
      0.875,
      1.0,
      1.125,
      1.25,
      1.375,
      1.497,
      1.5,
      1.503,
      1.625,
      1.75,
      1.875,
      2.0,
      2.125,
      2.25,
      2.375,
      2.5,
      2.625,
      2.75,
      2.875,
      2.997,
      3.0
    ],
    "samples": 29,
    "status": "PASS",
    "truth_mode": "deterministic_cad",
    "validation_tier": "geometry"
  },
  "sequence": "shuttle",
  "truth_mode": "deterministic_cad"
}
